
label,tweet
1,my life is meaningless i just want to end my life so badly my life is completely empty and i dont want to have to create meaning in it creating meaning is pain how long will i hold back the urge to run my car head first into the next person coming the opposite way when will i stop feeling jealous of tragic characters like gomer pile for the swift end they were able to bring to their lives
1,muttering i wanna die to myself daily for a few months now i feel worthless shes my soulmate i cant live in this horrible world without her i am so lonely i wish i could just turn off the part of my brain that feels 
1,work slave i really feel like my only purpose in life is to make a higher man money parents forcing me through college and i have too much on my plate i owe a lot of money i know this is the easy way out but i am really tired all of these issues are on top of dealing with tensions in america as well i want to rest
1,i did something on the 2 of october i overdosed i just felt so alone and horrible i was in hospital for two days now when i walk down the hallways of my school they always look at me weird and say i should take more pills and i hate it i have no one i have this voice in my head now and it wont go away and i cant be myself anymore thanks for reading
1,i feel like no one cares i just want to die maybe then i d feel less lonely
1,i am great and wonderful i am worth it except not enough to be anyones first choice everyone tells me how wonderful i am but not enough to be loved like i love others i put aside everything for people but i am too crazy to hold a job too nothing to be really loved i am not entitled and i dont even have the right to die on my own terms and i am an asshole for being angry about it for being upset that i am there when other people treat me like shit and cant be bothered wheni amhurt
1,i ll be dead just you wait and see my last words before my death for whoever is interestedi am sorry but youre better off without me youll learn to live without me it wont be difficult now i shall die 
1,health anxiety prompting some bad thoughts in my head i have been struggling for 2 months now with some health issues as a 26 year old male my pessimistic nature just makes me think about the worst my hands and feet are currently tingling and burning i just keep picturing myself on a wheelchair being a burden to my family girlfriend and so on suicide thoughts come to my mind as i prefer to put a sudden end to everything instead of deteriorating myself day after day losing motor and cognitive functions life is already hard as it is and now my health is failing for the first time 
1,everything is okay but nothing feels okay i ve always been a bit unhappy as a kid too i think although i can t remember much of my childhood i dont want to kill myself but sometimes that thought just comes creeping and it scares me a little a few weeks ago a problem came up it was a financial problem quite fixable but i just couldn t handle it i tied myself a noose and everything i was gonna do it i was all alone in the house with my dog so there was really no one that would be able to stop me i didnt do anything but i felt like i could have done it completely on impulse over a fixable problem leaving behind everything i love and my hopeful future i feel it now too creeping up on me everything should be fine but i cant help the feeling that i should just do it like everything would be easier for everyone if they would just realize how little they need me 
1,ptsd and alcohol i had some extremely horrible violent stuff happen to me a few years ago i was 21 nowi am26 i forgot about repressed it or whatever for several years something unrelated one day made me remember everything it all came flooding back into my mind and it was like i was reliving it all and felt like i was having a never ending panic attack for about 4 days this buried trauma explained a lot about why my alcohol pornography cigarette usages were all insanely high to the point they fucked up my life and relationships with people close to me in signifigant waysi amafraid to talk about what happened to anyone even people i trust like my family or a potential therapist due to extreme irrational paranoia about the people involved finding out and hurting me again and sometimesi amjust completely consumed by negative horrible thoughts and cant escape them i tried getting a sliding scale therapist a couple years ago and even t and gave up on the idea of therapy i dont know what to do i dont want to give up 
1,i dont have long left this past month has been the worst 3 weeks ago i went on date with a guy and went to his place afterwards and he tried to force me to go farther than i wanted to go ive been afraid to even hang out with a guy since the next day i was fired from my job i spent the whole rest of that week alone filling out job app which didnt help with my depression the next week i started having some issues went to get tested and found i had gotten gonorrhea from the guy that tried to force me i went to dinner at a friends house and my car ended up getting towed so i owe my mom 150 for that i almost attempted suicide that day last week and i started work last week but will only be getting a partial paycheck because of when i started and i amcurrently 75 for my bank account and behind on my bills so i dont know how much this check is gonna help i just dont have any fight left in me anymore
1,i almost attempted suicide again when someone blackmailed me and threatened to have me thrown in jail for something i didnt do he knew where i worked and my parents names
1,i am 16 and hate myself so much i have very little friends an introvert never had a girlfriend been bullied a lot and rejected a lot please help me i want to kill myself it would make all this go away i dont deserve to be on this earth since i write notes on paper of how worthless and stupid i am i want to become someone in the it field but i am too stupid to get in there anyways and jobs nowadays need social people and i am not one of them ive never had a girlfriend before and i want to have one because being a virgin is a bad thing and i could never live with that feeling if i dont have any friends or a girlfriend wheni am an adult i plan on committing suicide can you please help me thanks for reading
1,goodbye everybody abusive dad bullying being a wimp because i never had a father figure in my childhood never getting to fuck the girls i wanted to fuck never having a say in anything becausei am too weak to step up three tours in iraq killed people who tried killing me saw those people kill my friends lost both legs to a roadside i ed wanted to become a physician but dreams are exactly that a fantasy and not something achievable spent 10 years in prison after cops ransacked my home and found 5 grams of weed i grow tired of wading through this hell every day ive been waiting for this moment for a long time and i have a 9mm ready to get the job done quick and clean fuck this place
1,i cant stop fucking upi amselfish gutless disrespectful spiteful rude self righteous arrogant ignorantim forgetful unfelpful self centeredim stupid clutzy lazy depressed constantly exhausted i havent filled out any of my college applications because i didnt even plan on living this long i just want to die so i can stop disgracing my family and inconveniencing my mom i kind of want to be a ballistician they look at bullets from dead bodies to see what gun it came out of but honestly i am more likely to be the subject of one and i dont have any friends in or out of school why am i like this
1,i ve got exactly 23 days of life left and ive never felt so calm or at peace id rather not wait till then but its the first day i will be completely alone and have the time i need this
1,i hate my parents so much i want to kill myself to spite them especially my dad i almost do not want to have children because i do not want my dad to become a grandfather just like how he didnt want me to have a girlfriend or friends growing up i dont think i would even goto his funeral if he died i hate you from the bottom of my heart you only had me in order to chain down my mom you hated and ignored yelled at me since i was a little boy and now i hate you forever this hatred is killing me 
1,i cant live in this world ok its too much its too bad and too evil and i cant handle it anymore theres so much more evil in the world than good almost everyone is just apathetic about all the suffering in the world or people actively contribute to it people harass hate and kill each other for no reason people get killed by natural disasters and most people dont give a shit at all they just think whatever better them than me and move on with their lives 
1,why is mankind afraid of death lately i am asking myself more often and often why do we fear death nowdays back in the middle ages for example of course you fear getting in hell and stupid shit like that but today even if it is completly painless why would you struggle to just end it all i myself am not suicidal i would say even if i think about it more than often to just quit go the pussy but easy way why should i struggle with life instead of going the easy route personally i think its because mankind fears the unkown we dont know whats after death because none really came back from actual death and reported about it like actual clinical dead but is is really the only reason like i know i am not going to kill myself yet and it probably stays that way because i am just too much of a pussy to be a pussy if you get what i mean 
1,after failing once this is how i feel i wish that suicide was funded by the government i wish guns for suicide would be like condoms given to teens so if they are going to do it they do it right i wish euthansia was legal i wish that i wouldnt have to fear buying poison or a gun off the black market because if i get caught my life would get worse 
1,my girlfriend left me i hate college i have no direction in life i just want to go to sleep and never wake up ive been thinking about suicide a lot recently and different methods the only reason i havent done it so far is because i am too much of a pussy i have access to enough drugs to overdose on i live near plenty of tall buildings i am seeing a therapist and psychiatrist all the pills they ve given me have only exacerbated my symptoms i dont care about leaving everything behind because i dont want to hurt the people around me but why should i go on living my shit life just so others arent inconvenienced one of these days i ll be drunk enough to finally pull the trigger figuratively literally 
1,i am going to kill myself this weekend i dont see any reason to stay alive nothing has changed enough to make me want to stay i was raped as a kid and now all i am to people is a sex object good bye everyone 
1,i am going to kill myself tonight i am a lesbian grad student at a conservative big name school in america my life up until now has been shit i am lonely girls only want to use me for sex i dont feel loved by friends ive been struggling to find a dissertation lab i invented something for a professor in undergrad but now shes stealing it and giving me no credit i want to make sure i do it the right way so that i am gone i am just fucking tired of not feeling valued
1,i ended up in the hospital after suicide attempt and now my heart is messed up they wont let me leave until i am medically stable and then i have to go to psych hospital but i am not sure it will work
1,my 13 year old daughter overdosed on about 6 grams of wellbutrin and 1500mg of zoloft i am trying so hard to make this right she was airlifted to children s hospital and now she s laying in her hospital bed unresponsive and her muscles are jerking this has been the scariest day of my life that child is my entire world she s all i have i have out my heart and soul into raising her i never want to lose this little girl but here i am she s about to be 14 she s a little on the eccentric side but she has a heart of gold she s never met a stranger but ever since 8th grade has started she has been getting bullied and the teachers don t really do anything about it this was her way of coping i went to wake her for school this morning and found her covered in vomit and she had been hallucinating and having seizures for hours probably what if i hadn t found her why does she feel like this is the only way i want to make all the bad go away how do i do this how do i help her cope i didn t know who to turn to
1,now my heart wants to die too i ve been struggling with depression trauma and suicidal thoughts for years but honestly things havent been as painful as they are now i am here sitting alone and alienated confused depressed miserable helpless and alone and honestly at this point i just hate life
1,29 and missed my chance at love death cant come for me fast enough 144 iq thats 9983th percentile i also have a ms and ba from top ten schools cant figure this out somehow i am too old to attract someone i am attracted to and i am behind where a ivy graduate should be 42k at 29 years old in a temp position its just not enough to make me worth something i am so tired of not being loved for who i am and envy the attention women get i dont think i will ever be wanted like that just not good enough
1,i am newly married and my husband is wonderful i love him so much we are very much in love so why am i suicidal i honestly cant figure it out 9 days out of 10 i am absolutely fine happy positive excited about life then it hits me depression crippling anxiety suicidal thoughts i cut i cry i crumble on days like this i cant believe that anyone cares at all about me except my husband then i feel like i dont deserve him and sometimes push him away whats wrong with me what should i do i just cant shake the thought that everyone would be better off without me especially my husband
1,i am empty i ve been focusing on school and work but every day i feel worse and worse last night i got blackout drunk didnt help made me feel even worse i know that my loneliness comes mostly from my conscious decisions cant live with people cant live without them the only reason i havent killed myself yet is that i fear the pain 
1,the time has finally come i am finally ready to end it all after 25 years of a sickening life i am ready to end it all i should have done it earlier but my life was all about coping i ll die with depression and as an involutary celibate thought of resorting to sex work before death but i have no motivation for that i ll die in the city where i was born the bridge is 75 meters tall so it should be enough to kill me if i fall on concrete goodbye meaningless world
1,what now so i am 17 everyone knows i want to kill myself but nobody really acknowledges it as though even if i did it it would just be inevitable and nobody would give a shit which is true and i amfucking sick its been like 3 years of suicidal thoughts but over time theyve become disgustingly close to becoming reality and i am fucking scared i just want to die you know maybe i will
1,i dont know why i keep trying my home life has always been incredibly toxic and my parents have always been a major contributor to my depression and anxiety i just feel like a worthless individual i dont have a job and i am not doing anything and i have no motivation to even leave the house let alone my bed all my life shit like this has continued to happen to me and sometimes i look at all the pills i have to take and consider just shoving a handful in my mouth and ending it all but most of the time i just lie in my bed and wish i could die without actually having to kill myself because i am a coward i am so tired of hearing that things are gonna get better
1,running out of option it physically hurts to breathe i have no dream or goal or ambition or motivation i am tried of it all i have been to hospital er psyche ward therapist difference medications my girlfriend the only person i really loved who wasnt family wants to just go do drugs and drink or whatever the fuck leaving me here with nothing so i cant at least just talk to her any more about how i feel it hurts it hurts so much so much pain and why i dont know why was i born to suffer like this if god is real he wants me dead and i do too
1,i want everyone to feel my pain i am sick of everyone trying to hold me down and take advantage of mei amsick of always being second choicei amsick of being neglected feared and hated i want everyone to feel my wrath and my pain i am sick of hiding in the shadows and just taking it all i want everything they ever did to me to happen to them and 100 times over i hope they never get reliefi amsick of people and i am not afraid to admit it and it makes me sick to see so many happy people with perfect lives they dont deserve it if i cant be happy why should anyone else be
1,i cannot wait for my mum to fucking die all i wait is for her to die then i am going to lie under the train that very day and foolow suiti cannot wait i would kill her to be able to kill myself sooner but we are two in a very intimate relationship in short i can not kill her guns are forbiden in my country i have got only a knife or a brick to do it and so i cant do it it s very bloody and slow method cannot do anything my tonsils stink i hate human stench in all forms except dashas shits i hate my body hate arteries these nose and lips and saliva and eyes and all i hate human body except dashas one i want to fuck and to be with my dasha 
1,codeine ativan sleep meds alcohol tell me why i shouldnt i am hopeless i m ready to give up
1,i am just a mess i ran out of meds and i havent had the strength or energy to go refill them i went to class today and ended up sitting on a sidewalk ugly crying and making people think i am a fucking headcase all i do is sleep and i never feel rested i m alone in a new town and i have no friends and all i want is someone to sit with me and talk a while i am hanging in there because i brought my cats here to this strange place and i cant just leave them to think theyve been abandoned i just took a three hour nap and all i got was a headache and still tired i have no clean laundry my room is a clusterfuck i havent combed my hair in days or eaten and instead of doing things that need donei amlying here trying to avoid intrusive self harm thoughtsi amlazy and awful and i cant get myself to stop it
1,i hate feelings at this point i think i am clinging onto life waiting for the right set of circumstances to just let go my feelings keep holding me back i hate them i hate having to feel i hate each and every one of them theres something comforting about the idea of nonexistence something comforting about the idea of nothing i long for it
1,i just want to sleep so much has gone wrong in these 20 years and its still getting worse i can not change most of what is going on around me but it will invariably affect me i dont want to give it the chance so if i go and sleep and dont wake up i wont have to deal with it
1,standing in supermarket line and thinking how does it feel to jump off a high story building ive read stories that during the fall it makes you feel alive due to sudden surge of adrenaline okay lets back to supermarket few more people to go then thinking will this ever stop feeling like total zombie i got out of store sit on public bus thinking how i am institutionalized and tied to hospital bed in psych wardslol okayi amback in the busokayi amdealing with this crap for 5 years i totally have no energy remaining i have job that requires working part time from home okay i do my job and fall asleep immediately last session my psych told me that there is no working medicine for me because we tried everything currently on low dose of ssri and benzo my real world productivity is literally 0 i go sometimes out for a drink with friends feeling like depersonalized shit begging from inside that they stop talking to me sometimes because i have no power to engage in conversation
1,i am worried i might lose it tomorrow i cant really tell anyone for fear of worrying them i will be one year and eleven months clean and sober tomorrow i am going to be off my methadone maintenance program in two weeks i am going to walk home from the court pack all my things and clean my apartment and say my goodbyes its just too much i am really hoping it doesnt come to that i hope so fucking much i dont want to kill myself i dont want to do that to anyone i am not strong enough to start over again my chest feels like its going to explode with anxiety i feel like i am going to break down crying in front of the judge tomorrow practically pleading for my life 
1,death cant be much worse i am 22 male my girlfriend left i have been staying late in the office for too long because i cant cope with the workload friends are non existent hate my family and they hate me i just want to die i dont see any other option at this point
1,every day just brings me closer to death i am 21 years old working student i want to kill myself life is unbearable i have no skills not talents and i am absolutely boring person so i spend most of my free time alone i really want to find a girlfriend but i see no way how could i find one when i am useless like this i used to go away from sadness by listening to music but these days i am bored of music and just want to go to sleep and never wake up 
1,please forgive me i tried to get help i dont know what else to say i am tired of being a burden on everyone else i am tired of everyone writing me off i cant help who i am and i have tried to get help i have a plan and in a few weeks i will no longer be a part of this world
1,just got in a car accident and i wish it had been worse and that i had gotten fatally injured when i was driving sometimes i imagine just crashing into something and dying i have had some close calls recently with other drivers and i often think afterward that i wish they had ended up hitting me i dont know why i feel like this ive been taking sertraline the generic version of zoloft which has stopped me from feeling horrible on a normal day to day basis but whenever something out of the ordinary happens like this car accident or i mess something up its like i had never taken the medsi feel like i both want to and dont want to die these last couple of years have been horrible for me but i still have dreams and want to do things before i started taking the sertraline i was actively planning my death but now its like i feel half wanting to keep going and half wanting to die before my life moves forward too much this car accident is going to cost me and my family a lot of money and its all my fault maybe they would have gotten some compensation if i had died if i wasnt around anymore they would be sad but i also wouldnt be able to disappoint them and cost them more than they can afford anymorei ama terrible daughter
1,do you ever feel empty and you had to pick a number from 15 depending how you feel about it i could write my funeral speech now but what is the point in afew years i would be forgotten anyway 
1,i am looking for someone to talk to all i want to do is die 
1,i will probably kill myself before 2018 i have always been depressed as long as i can remember summers are better but school always makes it much worse i probably would have tried to kill myself last may if i had a car now i do last may was the worst its ever been i transferred to an early college program soi amtaking classes at the cc instead of my shitass high school ive only been in school for two weeks and its progressing way faster than normal idk why i want to die nothing traumatic has happened to me but i do i hate myself so much i will probably co myself if this doesnt get better soon
1,if i am not happy by age 25 i think its best that i just die i am 19 years old i have had anxiety my entire life and depression since i was 12 and its gotten worse and worse over the years add misophonia to that and it makes life torture its especially bad now because i dont know what the fucki am doing in life the only reason i have to live is for my friends and family and because i am too scared to die which is ironic because i wish i was dead most of the time or at least i wish i had never been born but life is scary too anyway if things dont get better in the next 5 years then i fucking quit or maybe i ll pussy out like the pathetic piece of shit coward i am i dont know 
1,i sexually harassed my crush i feel like there is no place for me in the world for a long time now about half a year i have been touching my crush who is not interested in me without consent i work alongside him and we are both part of a very tight group of friends so he has to see me every day and every single time i try to touch him stare at him and sometimes even take pictures of him only recently i have realized the implications of what i have done and that i am hurting him i feel like i betrayed him and myself for doing something that is completely against all my values i want to change and i know i can but i amafraid i will lose the will to live if i cant get myself to stop touching him 
1,i think my moment is coming it seems that the pieces of my life are already set it seems that fate so wants my mom will leave the house for a while for her work seems to be my opportunity to be free nobody cares if i die every day i get up and i think about suicide and how to carry it out i wish i had a gun i think i will find a way to do it ive already lost everything i can not enjoy my music like before the girl i like is in love with someone else i have no friends and i never had a girlfriend that disgust of life maybe is better leave this place 
