
1,i am getting close and i am not sure what to do anymore i have been really struggeling for about 5 month now i broke up with someone who i loved very much i first turned to drinking and drugs to ease the pain but i got quite suicidal it got so bad i had to make some major changes in my life or i didnt think i was going to make it i have done absolutely everything i can to pick myself up therapy psychiatrist lexapro quit drinking quit smoking started working out started eating right started travelling focused on work and even started hobbies despite all this somet it feels like nothing is helping i can barely get out of bed most daysi amon the verge of tears every day it is difficult to do anthing its even hard to write this post i dont know what to do anymore i wake up everyday feeling like i am being tortured its been 5 months and it is driving me nuts feeling like i cant escape i could really use some words of wisdom right now
1,i dont know anymore these 4 words make my life a living hell no matter who i say it to in the sudden absence of happiness i know only sadness i have nothing to look forward to because i have fucked my chances up at even having something decent no job no girlfriend and absolutely nothing to motivate me at this point i dont even know why i am still alive it pains me that i am alive
1,my life has no purpose i am broke lonely and miserable i am so my life is a sack of shit my family legitimately hate me i am poor i have some friends but dont hear from them unless i get in touch first i have been single for almost a decade generally i am ok with being single but depression grinds my world to a halt doctors dont help me nobody around me seems to understand this has gone on for 30 years i am tired cant do it any more i just want to lay down and die quietly all i want in life is to disappear
1,i am going to kill myself right now i am sorry you are feeling so desperate
1,i want to die where can i go to commit suicide give me an injection as i am unconconscious and end my nightmare life i want to die
1,why am i so weak that i cant keep up besides its not my new jobs fault thati amfeeling this way so why should i punish them by going on a leaveim supposed to be better than this at this pointi am so terrified of taking stress leave that nowi amstarting to be convinced killing myself is the only option my doctor has me on meds probably because i am crazy i dont know i dont have any friends either or a family support net so dont with that friend shit and all i have is my boyfriend to talk to but this isnt his problem i wont saddle him with my weakness i am a shit person i deserve this
1,so i have been in a suicide rehab center for the last month i am just over life it is not sadness or depression i just give up it would just be easier to be dead 
1,if i tell a psychiatrist that i am suicidal will they immediately have me shipped away and handcuffed to a bed i always lie
1,these thoughts about killing myself her getting louder
1,didn t kill myself yet i guess that is something to be proud of i had a gun but my roommate found it planning on finding a lonely bridge to end it i really want a reason to live but i just can t find one
1,in debt i will kill myself on thursday i am going to stab myself in the stomach or take a lot of pills i m not sure which to do yet sorry for spelling and grammar i am sure nobody here cares anyways 
1,i shouldnt want to kill myself i have so many advantages in life all of my immediate family is alive and still involved in my life i have several friends who i frequently talk to i make more than enough money to live on easily but every night i go home and drink hoping i will forget about how much i just want it all to end every single moment that i am sober i spend thinking that people might actually see me for who i really am a lazy waste of space who lucked into success and wheni amdrunk i worry that people will find out thati am trying to slowly kill myself with alcohol fuck i always thought if i could just be successful i would be happy well i am not
1,i m not safe with myself i have been suicidal for a while now i have made 4 attempts this year and yet nobody seems to get it i honestly cant say if i am going to kill myself today i keep breaking down crying and i dont know why i hate myself 
1,feeling numb hate my job i hate waking up everyday i feel nothing feel like i am on autopilot i got dumped 3 months ago almost from a 4 year relationship nothing cheers me up anymore my parents are in another state so i just can t go see them whenever i want i don t know if i could actually end it myself but i do dream of other ways like a car hitting me and killing me instantly i sometimes think of just taking a bunch of pills and letting that be it 
1,i have bipolar 2 disorder and i have become hyper aware of my mood swings they get bad enough where i can barely get out of bed talk to my friends or even work and during the manic episodes i dont sleep maybe 34 hours at night my mind races i make highly unrealistic goals and then get hit again with the crippling depression 
1,i think its tonight because i dont care and i have nothing left i dont care i had something so great so promising and they stripped it down past the bone into splinters then pissed on the splinters i dont want happiness i dont want dreams i dont care that if i post a note everyone will desperately try to stop me i know they ll care when i am about to die or dead i am numb i am no longer scared and the hurt is too much i gotta go i have nothing left i had a lot of love to give but its gone with me i just wanted someone to hear me before the end 
1,i want to kill myself but i am afraid to die i have been dealing with this pain for about 3 years i have seen many therapists and have tried medication nothing has worked i told my parents tonight that i wanted to commit suicide and it has caused nothing but chaos in my house i have been looking online for ways to die and have figured that drinking and taking medication is the way to go for me i have already been drinking but have been hesitant to take medication because i am scared to die i do not believe in god i do not know what comes after death i am scared of pain and afraid that it will hurt and i will not succeed
1,i can t do this anymore i have no hope i m a senior in college and i just want to die i don t fit in and i feel like no one cares about me everyday i wake up and i try to tell myself that today is a new day but it doesn t work i hate everything about myself and i feel so alone i have no one i don t care how i look and i don t even want to get up in the mornings i just want to end it all end all the suffering and the pain i just want to feel nothing for my anxiety and depression to leave me alone i don t know where to turn but i just can t keep doing this anymore 
1,stuck every time i try and kill myself i cant go through with it but i cant keep living feeling this way why cant i just let myself die
1,at this point i dont even mind the pain i just want out of life
1,i feel like my time is coming soon like i m running out of time i ve had enough and i m ready to call it quits i ve attempted before but this time i can t afford to fail i have many different pills and other ways i can end it i just need to figure out the best time when maybe tonight maybe tomorrow who knows
1,with my financial situation getting worse so does my mental health suicide is my plan z and i feel like i am about to reach plan z i think i should have just committed suicide at 15 years old when i thought about it a lot now i grew up and i made my life worse 
1,preparing for death letting things go i just have one last thing to let go of not trying to get people to panic and attempt to save me as if they could just feels good to be real somewhere to share whats going on to wonder if it will make someone else feel less alone perhaps just me 
1,my unofficial diagnosis is bipolar schizoaffective disorder it was a nightmare with so much trial and error with all sorts of therapies my medication a cocktail of about 20 pills a day has gotten me to a point where i can function day to day i dont know how i feel right now all i know though is i want it to stop 
1,feeling overwhelmed and wanting to die i tried to kill myself today all i wanted was my boyfriend to help me somehow since he sees me on this depression spiral but all he says is it will get better i know it will but currently i feel trapped in my own home i have no friends and i constantly feel weak or unmotivated i have no desire to have sex with my partner and tend to find the worst in him lately i love him but some things he does amplifies my depression i dont want to die but when i get hurt lonely or overwhelmed the one thought i cant shake is killing myself 
1,i have been reading about a group called dignitas in switzerland they provide assisted suicide via drugs that the member you have to become a member administers themselves anyone have any insight on americans travelling there for this purpose apparently they have helped many british and german citizens pass peacefully 
1,i dont tell people how i feel because i am pretty sure nobody cares about me even writing this brings me anxiety because i know i have to interact with people i just wish i could cry myself to sleep and never wake up no one would every truly miss me
1,i want to overdose on advil and benadryl and just end this i have enough to do the job i am really tired of this shit i just want to give up
1,i am a 20 year old transgirl who has been on hormones for about 4 months recently i suffered from a depressive episode due to gender dysphoria until about a couple weeks ago i just got a job and i was presenting myself as female and using a female name the only problem is that i still look somewhat masculine so i get stared at constantly and dismissed i cannot connect with any of my coworkers because i look and act strange to them i know i am supposed to wait on these hormones but i am really scared what if they dont work what if i ll get beaten up what if i lose my job due to just being me i want to be happy but its so hard its gotten to the point where all i do is just think about death and hope maybe i will get a do over i just cant take any of this anymore
1,school is the worst i get so nervous and worked up about it that i throw up or pass out i will force myself to pass out by hyperventilating just to get a break from it all i dont know what to do and i am starting to get suicidal thoughts my mom only shames me for procrastinating too much or poor me shit please help